{
  "assetId": "60000000-0000-4000-8000-000000000001",
  "mimeType": "image/jpeg",
  "fileName": "situation-photo.jpg",
  "sizeBytes": 345678,
  "sha256": "aaaaaaaaaaaaaaaaaaaaaaaaaaaaaaaaaaaaaaaaaaaaaaaaaaaaaaaaaaaaaaaa",
  "createdAt": "2026-07-11T10:01:00.000Z",
  "expiresAt": "2026-07-12T10:01:00.000Z",
  "source": "camera",
  "widthPx": 1920,
  "heightPx": 1080
}
